{
  "protocol": 1,
  "type": "page",
  "component": "Dashboard",
  "url": "/",
  "props": {
    "auth": { "user": { "id": 1, "name": "Ada" } },
    "recentCustomers": [{ "id": 22, "name": "Globex" }]
  },
  "build": "3f9c1a",
  "deferred": {
    "default": ["stats"],
    "charts": ["revenue", "signups"]
  }
}
