{
  "protocol": 1,
  "type": "page",
  "component": "Customers/Index",
  "url": "/customers?page=2",
  "props": {
    "customers": {
      "data": [
        {
          "id": 21,
          "name": "Acme",
          "email": "hello@acme.test"
        },
        {
          "id": 22,
          "name": "Globex",
          "email": "info@globex.test"
        }
      ],
      "links": {
        "first": "/customers?page=1",
        "last": "/customers?page=3",
        "prev": "/customers?page=1",
        "next": "/customers?page=3"
      },
      "meta": {
        "current_page": 2,
        "from": 21,
        "last_page": 3,
        "links": [
          {
            "url": "/customers?page=1",
            "label": "&laquo; Previous",
            "page": 1,
            "active": false
          },
          {
            "url": "/customers?page=1",
            "label": "1",
            "page": 1,
            "active": false
          },
          {
            "url": "/customers?page=2",
            "label": "2",
            "page": 2,
            "active": true
          },
          {
            "url": "/customers?page=3",
            "label": "3",
            "page": 3,
            "active": false
          },
          {
            "url": "/customers?page=3",
            "label": "Next &raquo;",
            "page": 3,
            "active": false
          }
        ],
        "path": "/customers",
        "per_page": 20,
        "to": 22,
        "total": 57
      }
    }
  },
  "build": "3f9c1a",
  "meta": {
    "merge": ["customers"],
    "matchOn": {
      "customers": ["data.id"]
    },
    "scroll": {
      "customers": {
        "pageName": "page",
        "dataPath": "data",
        "currentPage": 2,
        "previousPage": 1,
        "nextPage": 3
      }
    }
  }
}
