{
  "protocol": 1,
  "type": "page",
  "component": "Customers/Create",
  "url": "/customers/create",
  "props": {
    "auth": { "user": { "id": 1, "name": "Ada" } },
    "statuses": ["active", "inactive"]
  },
  "build": "3f9c1a",
  "meta": {
    "once": { "statuses": { "key": "customer-statuses", "expiresAt": null } }
  }
}
